{
  "schemaVersion": 1,
  "id": "ref-streetlight",
  "name": "Streetlight reference",
  "category": "prop",
  "units": "metres",
  "voxelSize": 0.1,
  "size": [
    10,
    65,
    24
  ],
  "pivot": "base-center",
  "orientation": {
    "up": "+Y",
    "front": "-Z"
  },
  "palette": [
    {
      "id": "base",
      "color": "#737f7b",
      "material": "matte"
    },
    {
      "id": "pole",
      "color": "#7a8e8d",
      "material": "matte"
    },
    {
      "id": "housing",
      "color": "#526368",
      "material": "matte"
    },
    {
      "id": "lens",
      "color": "#dfdac1",
      "material": "matte"
    },
    {
      "id": "stripe",
      "color": "#d4b567",
      "material": "matte"
    }
  ],
  "cells": [
    {
      "position": [
        1,
        0,
        15
      ],
      "palette": "base"
    },
    {
      "position": [
        1,
        0,
        16
      ],
      "palette": "base"
    },
    {
      "position": [
        1,
        0,
        17
      ],
      "palette": "base"
    },
    {
      "position": [
        1,
        0,
        18
      ],
      "palette": "base"
    },
    {
      "position": [
        1,
        0,
        19
      ],
      "palette": "base"
    },
    {
      "position": [
        1,
        0,
        20
      ],
      "palette": "base"
    },
    {
      "position": [
        1,
        0,
        21
      ],
      "palette": "base"
    },
    {
      "position": [
        1,
        0,
        22
      ],
      "palette": "base"
    },
    {
      "position": [
        1,
        1,
        15
      ],
      "palette": "base"
    },
    {
      "position": [
        1,
        1,
        16
      ],
      "palette": "base"
    },
    {
      "position": [
        1,
        1,
        17
      ],
      "palette": "base"
    },
    {
      "position": [
        1,
        1,
        18
      ],
      "palette": "base"
    },
    {
      "position": [
        1,
        1,
        19
      ],
      "palette": "base"
    },
    {
      "position": [
        1,
        1,
        20
      ],
      "palette": "base"
    },
    {
      "position": [
        1,
        1,
        21
      ],
      "palette": "base"
    },
    {
      "position": [
        1,
        1,
        22
      ],
      "palette": "base"
    },
    {
      "position": [
        2,
        0,
        15
      ],
      "palette": "base"
    },
    {
      "position": [
        2,
        0,
        16
      ],
      "palette": "base"
    },
    {
      "position": [
        2,
        0,
        17
      ],
      "palette": "base"
    },
    {
      "position": [
        2,
        0,
        18
      ],
      "palette": "base"
    },
    {
      "position": [
        2,
        0,
        19
      ],
      "palette": "base"
    },
    {
      "position": [
        2,
        0,
        20
      ],
      "palette": "base"
    },
    {
      "position": [
        2,
        0,
        21
      ],
      "palette": "base"
    },
    {
      "position": [
        2,
        0,
        22
      ],
      "palette": "base"
    },
    {
      "position": [
        2,
        1,
        15
      ],
      "palette": "base"
    },
    {
      "position": [
        2,
        1,
        16
      ],
      "palette": "base"
    },
    {
      "position": [
        2,
        1,
        17
      ],
      "palette": "base"
    },
    {
      "position": [
        2,
        1,
        18
      ],
      "palette": "base"
    },
    {
      "position": [
        2,
        1,
        19
      ],
      "palette": "base"
    },
    {
      "position": [
        2,
        1,
        20
      ],
      "palette": "base"
    },
    {
      "position": [
        2,
        1,
        21
      ],
      "palette": "base"
    },
    {
      "position": [
        2,
        1,
        22
      ],
      "palette": "base"
    },
    {
      "position": [
        2,
        62,
        0
      ],
      "palette": "housing"
    },
    {
      "position": [
        2,
        62,
        1
      ],
      "palette": "housing"
    },
    {
      "position": [
        2,
        62,
        2
      ],
      "palette": "housing"
    },
    {
      "position": [
        2,
        62,
        3
      ],
      "palette": "housing"
    },
    {
      "position": [
        2,
        62,
        4
      ],
      "palette": "housing"
    },
    {
      "position": [
        2,
        62,
        5
      ],
      "palette": "housing"
    },
    {
      "position": [
        2,
        62,
        6
      ],
      "palette": "housing"
    },
    {
      "position": [
        2,
        62,
        7
      ],
      "palette": "housing"
    },
    {
      "position": [
        2,
        63,
        0
      ],
      "palette": "housing"
    },
    {
      "position": [
        2,
        63,
        1
      ],
      "palette": "housing"
    },
    {
      "position": [
        2,
        63,
        2
      ],
      "palette": "housing"
    },
    {
      "position": [
        2,
        63,
        3
      ],
      "palette": "housing"
    },
    {
      "position": [
        2,
        63,
        4
      ],
      "palette": "housing"
    },
    {
      "position": [
        2,
        63,
        5
      ],
      "palette": "housing"
    },
    {
      "position": [
        2,
        63,
        6
      ],
      "palette": "housing"
    },
    {
      "position": [
        2,
        63,
        7
      ],
      "palette": "housing"
    },
    {
      "position": [
        2,
        64,
        0
      ],
      "palette": "housing"
    },
    {
      "position": [
        2,
        64,
        1
      ],
      "palette": "housing"
    },
    {
      "position": [
        2,
        64,
        2
      ],
      "palette": "housing"
    },
    {
      "position": [
        2,
        64,
        3
      ],
      "palette": "housing"
    },
    {
      "position": [
        2,
        64,
        4
      ],
      "palette": "housing"
    },
    {
      "position": [
        2,
        64,
        5
      ],
      "palette": "housing"
    },
    {
      "position": [
        2,
        64,
        6
      ],
      "palette": "housing"
    },
    {
      "position": [
        2,
        64,
        7
      ],
      "palette": "housing"
    },
    {
      "position": [
        3,
        0,
        15
      ],
      "palette": "base"
    },
    {
      "position": [
        3,
        0,
        16
      ],
      "palette": "base"
    },
    {
      "position": [
        3,
        0,
        17
      ],
      "palette": "base"
    },
    {
      "position": [
        3,
        0,
        18
      ],
      "palette": "base"
    },
    {
      "position": [
        3,
        0,
        19
      ],
      "palette": "base"
    },
    {
      "position": [
        3,
        0,
        20
      ],
      "palette": "base"
    },
    {
      "position": [
        3,
        0,
        21
      ],
      "palette": "base"
    },
    {
      "position": [
        3,
        0,
        22
      ],
      "palette": "base"
    },
    {
      "position": [
        3,
        1,
        15
      ],
      "palette": "base"
    },
    {
      "position": [
        3,
        1,
        16
      ],
      "palette": "base"
    },
    {
      "position": [
        3,
        1,
        17
      ],
      "palette": "base"
    },
    {
      "position": [
        3,
        1,
        18
      ],
      "palette": "base"
    },
    {
      "position": [
        3,
        1,
        19
      ],
      "palette": "base"
    },
    {
      "position": [
        3,
        1,
        20
      ],
      "palette": "base"
    },
    {
      "position": [
        3,
        1,
        21
      ],
      "palette": "base"
    },
    {
      "position": [
        3,
        1,
        22
      ],
      "palette": "base"
    },
    {
      "position": [
        3,
        2,
        17
      ],
      "palette": "housing"
    },
    {
      "position": [
        3,
        2,
        18
      ],
      "palette": "housing"
    },
    {
      "position": [
        3,
        2,
        19
      ],
      "palette": "housing"
    },
    {
      "position": [
        3,
        2,
        20
      ],
      "palette": "housing"
    },
    {
      "position": [
        3,
        3,
        17
      ],
      "palette": "housing"
    },
    {
      "position": [
        3,
        3,
        18
      ],
      "palette": "housing"
    },
    {
      "position": [
        3,
        3,
        19
      ],
      "palette": "housing"
    },
    {
      "position": [
        3,
        3,
        20
      ],
      "palette": "housing"
    },
    {
      "position": [
        3,
        4,
        17
      ],
      "palette": "housing"
    },
    {
      "position": [
        3,
        4,
        18
      ],
      "palette": "housing"
    },
    {
      "position": [
        3,
        4,
        19
      ],
      "palette": "housing"
    },
    {
      "position": [
        3,
        4,
        20
      ],
      "palette": "housing"
    },
    {
      "position": [
        3,
        5,
        17
      ],
      "palette": "housing"
    },
    {
      "position": [
        3,
        5,
        18
      ],
      "palette": "housing"
    },
    {
      "position": [
        3,
        5,
        19
      ],
      "palette": "housing"
    },
    {
      "position": [
        3,
        5,
        20
      ],
      "palette": "housing"
    },
    {
      "position": [
        3,
        6,
        17
      ],
      "palette": "housing"
    },
    {
      "position": [
        3,
        6,
        18
      ],
      "palette": "housing"
    },
    {
      "position": [
        3,
        6,
        19
      ],
      "palette": "housing"
    },
    {
      "position": [
        3,
        6,
        20
      ],
      "palette": "housing"
    },
    {